{
  "$schema": "../../schemas/v1/bone.schema.json",
  "key": "slimevr:right_ring_distal",
  "nameKey": "slimevr:bone.right_ring_distal",
  "parent": "slimevr:right_ring_intermediate",
  "tailOffset": {
    "terms": [
      {
        "proportion": "slimevr:hand_y",
        "direction": {
          "x": 0,
          "y": -0.174685,
          "z": 0
        }
      }
    ]
  },
  "rotationFallback": {
    "type": "none"
  }
}
