{
  "$schema": "../../schemas/v1/bone.schema.json",
  "key": "slimevr:right_upper_leg",
  "nameKey": "slimevr:bone.right_upper_leg",
  "parent": "slimevr:hip",
  "headOffset": {
    "terms": [
      {
        "proportion": "slimevr:hips_width",
        "direction": {
          "x": 0.5,
          "y": 0,
          "z": 0
        }
      }
    ]
  },
  "tailOffset": {
    "terms": [
      {
        "proportion": "slimevr:upper_leg",
        "direction": {
          "x": 0,
          "y": -1,
          "z": 0
        }
      }
    ]
  },
  "rotationFallback": {
    "type": "none"
  },
  "constraint": {
    "type": "twistSwing",
    "twistDegrees": 120,
    "swingDegrees": 170
  }
}
