{
  "$schema": "../../schemas/v1/bone.schema.json",
  "key": "slimevr:left_little_distal",
  "nameKey": "slimevr:bone.left_little_distal",
  "mirror": "slimevr:right_little_distal",
  "parent": "slimevr:left_little_intermediate",
  "tailOffset": {
    "terms": [{"proportion": "slimevr:hand_y", "direction": {"x": 0, "y": -0.14973, "z": 0}}]
  },
  "rotationFallback": {"type": "none"},
  "outputs": {
    "vmc": {
      "name": "LeftLittleDistal",
      "restRotation": [{"axis": {"x": 0, "y": 0, "z": 1}, "degrees": -90}]
    }
  }
}
